{
  "schema": "panda.session.event.v1",
  "seq": 2,
  "ts": "2026-10-25T12:00:00.000Z",
  "session_id": "s_20261025T120000Z_ab12cd",
  "type": "validate.result",
  "data": {
    "ok": false,
    "failed_checks": ["numbers"]
  },
  "prev": "0000000000000000000000000000000000000000000000000000000000000000",
  "hash": "aaaaaaaaaaaaaaaaaaaaaaaaaaaaaaaaaaaaaaaaaaaaaaaaaaaaaaaaaaaaaaaa"
}
